{
  "snapshotFormatVersion": "1.0.0",
  "snapshot": "../../../em-manager/migrations/20260929231730_store.json",
  "pinnedSnapshot": "20260929231730_store",
  "sourceRefs": {
    "boardId": "05a02a55-6eb6-41e0-b692-b9b40501af7b",
    "chapterId": "54ddc847-aa4a-44ba-9ee6-f356141b4744",
    "sliceBorderIds": [
      "7ee2e11c-7f18-4469-a810-8c9837608a6a"
    ],
    "columnIds": [
      "38a8ae5e-fb3d-4ce7-848f-8172e180d311"
    ]
  },
  "sliceTitle": "Dereserve Stock Item",
  "sliceType": "STATE_CHANGE",
  "sliceStatus": "Done"
}
