{
  "snapshotFormatVersion": "1.0.0",
  "snapshot": "../../../em-manager/migrations/20260929200131_store.json",
  "pinnedSnapshot": "20260929200131_store",
  "sourceRefs": {
    "boardId": "05a02a55-6eb6-41e0-b692-b9b40501af7b",
    "chapterId": "54ddc847-aa4a-44ba-9ee6-f356141b4744",
    "sliceBorderIds": [
      "2bf88581-0bb0-4bff-a502-f234c213b1a2"
    ],
    "columnIds": [
      "166f85da-4461-4ece-8434-e5b0d3bb74e0"
    ]
  },
  "sliceTitle": "Webhook Simulator Automator",
  "sliceType": "AUTOMATION",
  "sliceStatus": "Planned"
}
