{
  "snapshotFormatVersion": "1.0.0",
  "snapshot": "../../../em-manager/migrations/20260929231730_store.json",
  "pinnedSnapshot": "20260929231730_store",
  "sourceRefs": {
    "boardId": "05a02a55-6eb6-41e0-b692-b9b40501af7b",
    "chapterId": "54ddc847-aa4a-44ba-9ee6-f356141b4744",
    "sliceBorderIds": [
      "e46420b2-48c6-4d87-9a8d-244feefe9f48"
    ],
    "columnIds": [
      "ff3436e4-9e7f-4dee-8391-431d4a95f158"
    ]
  },
  "sliceTitle": "Create Cart",
  "sliceType": "STATE_CHANGE",
  "sliceStatus": "Done"
}
