{
  "snapshotFormatVersion": "1.0.0",
  "snapshot": "../../../em-manager/migrations/20260929200131_store.json",
  "pinnedSnapshot": "20260929200131_store",
  "sourceRefs": {
    "boardId": "05a02a55-6eb6-41e0-b692-b9b40501af7b",
    "chapterId": "54ddc847-aa4a-44ba-9ee6-f356141b4744",
    "sliceBorderIds": [
      "f0d3be81-f2d2-4123-b886-ba23114fa866"
    ],
    "columnIds": [
      "6dbb4a3e-a76f-4508-85c0-15758dc925ef"
    ]
  },
  "sliceTitle": "Sell Stock Item",
  "sliceType": "STATE_CHANGE",
  "sliceStatus": "Planned"
}
