{
  "snapshotFormatVersion": "1.0.0",
  "snapshot": "../../../em-manager/migrations/20260929200131_store.json",
  "pinnedSnapshot": "20260929200131_store",
  "sourceRefs": {
    "boardId": "05a02a55-6eb6-41e0-b692-b9b40501af7b",
    "chapterId": "54ddc847-aa4a-44ba-9ee6-f356141b4744",
    "sliceBorderIds": [
      "521b19bc-49d9-4689-908d-2a70c293bc17"
    ],
    "columnIds": [
      "14c68132-feda-4a43-b037-31665f08dc08"
    ]
  },
  "sliceTitle": "Reserve Stock Item",
  "sliceType": "STATE_CHANGE",
  "sliceStatus": "Done"
}
